{
  "$schema": "https://json-schema.org/draft/2020-12/schema",
  "$id": "https://github.com/tt-a1i/archify/schemas/tree.schema.json",
  "title": "Archify Hierarchy and Tree Diagram",
  "type": "object",
  "additionalProperties": false,
  "required": [
    "schema_version",
    "diagram_type",
    "meta",
    "nodes"
  ],
  "properties": {
    "schema_version": {
      "const": 1
    },
    "diagram_type": {
      "const": "tree"
    },
    "meta": {
      "type": "object",
      "additionalProperties": false,
      "required": [
        "title"
      ],
      "properties": {
        "title": {
          "type": "string",
          "minLength": 1
        },
        "locale": {
          "$ref": "common.schema.json#/$defs/locale"
        },
        "translations": {
          "$ref": "common.schema.json#/$defs/translations"
        },
        "subtitle": {
          "type": "string"
        },
        "output": {
          "type": "string"
        },
        "animation": {
          "$ref": "common.schema.json#/$defs/animation"
        },
        "visual_preset": {
          "$ref": "common.schema.json#/$defs/visualPreset"
        },
        "quality_profile": {
          "$ref": "common.schema.json#/$defs/qualityProfile"
        },
        "repository": {
          "$ref": "common.schema.json#/$defs/repository"
        },
        "views": {
          "$ref": "common.schema.json#/$defs/guidedViews"
        },
        "viewBox": {
          "type": "array",
          "prefixItems": [
            {
              "type": "number",
              "minimum": 320
            },
            {
              "type": "number",
              "minimum": 240
            }
          ],
          "items": false,
          "minItems": 2,
          "maxItems": 2
        },
        "input_contract": {
          "const": "phoenix-v1"
        }
      }
    },
    "layout": {
      "type": "object",
      "additionalProperties": false,
      "properties": {
        "direction": {
          "enum": [
            "down",
            "right"
          ]
        },
        "gapX": {
          "type": "number",
          "minimum": 16
        },
        "gapY": {
          "type": "number",
          "minimum": 24
        },
        "nodeW": {
          "type": "number",
          "minimum": 96
        },
        "nodeMaxW": {
          "type": "number",
          "minimum": 120
        }
      }
    },
    "nodes": {
      "type": "array",
      "minItems": 1,
      "items": {
        "type": "object",
        "additionalProperties": false,
        "required": [
          "id",
          "label"
        ],
        "properties": {
          "id": {
            "$ref": "common.schema.json#/$defs/id"
          },
          "label": {
            "type": "string",
            "minLength": 1
          },
          "parent": {
            "$ref": "common.schema.json#/$defs/id"
          },
          "sublabel": {
            "type": "string"
          },
          "collapsed": {
            "type": "boolean"
          },
          "sources": {
            "$ref": "common.schema.json#/$defs/sourceReferences"
          }
        }
      }
    },
    "cards": {
      "$ref": "common.schema.json#/$defs/cards"
    }
  }
}
